{
  "id": "node-aurora-hero",
  "type": "shader",
  "effectId": "aurora-field",
  "frame": {
    "width": 1440,
    "height": 900,
    "rotation": 0
  },
  "params": {
    "palette": [
      "#102542",
      "#2d6cdf",
      "#6ce2d9",
      "#f5f1c8"
    ],
    "density": 0.45,
    "flow": 0.5,
    "contrast": 0.55,
    "opacity": 1
  },
  "seed": 42,
  "exportOverrides": {
    "quality": "auto",
    "animate": true,
    "time": 0
  }
}
